id,name,category,price,description,specs,brand,rating,stock,weight,color,warranty,release_year,discount,is_available,storage,ram,display_size,battery,best_for
91,Amazon Echo Dot 4,smart_home,4999,Умная колонка с Alexa,"Динамик: 1.6"", Голосовой помощник: Alexa, Подключение: Wi-Fi",Amazon,4.3,124,"341g","Темно-синий, Белый",1,2023,0,true,"-","-","-","-","умный дом"
92,Google Nest Hub 2,smart_home,8999,Умный дисплей с Google Assistant,"Экран: 7"" LCD, Голосовой помощник: Google Assistant, Камера: для жестов",Google,4.4,67,"558g","Песочный, Белый",2,2023,10,true,"-","-","7"","-","умный дом"
93,Apple HomePod mini,smart_home,9999,Умная колонка с Siri,"Звук: 360°, Голосовой помощник: Siri, Совместимость: Apple devices",Apple,4.5,58,"345g","Белый, Темно-серый",1,2023,0,true,"-","-","-","-","аудио"
96,PlayStation 5,gaming_console,49999,Игровая консоль нового поколения,"Процессор: AMD Ryzen Zen 2, Графика: AMD RDNA 2, Совместимость: 4K 120Hz",Sony,4.9,8,"4.5kg","Белый",2,2023,0,true,"825GB SSD","16GB","-","-","гейминг"
97,Xbox Series X,gaming_console,47999,Мощная игровая консоль,"Процессор: Custom Zen 2, Графика: 12 TFLOPS, Разрешение: 8K",Microsoft,4.8,11,"4.4kg","Черный",2,2023,5,true,"1TB SSD","16GB","-","-","гейминг"
98,Nintendo Switch,gaming_console,29999,Гибридная игровая консоль,"Режимы: TV/Tabletop/Handheld, Контроллеры: Joy-Con, Экран: 6.2"" LCD",Nintendo,4.7,34,"398g","Неон, Серый",2,2023,10,true,"32GB","4GB","6.2"","4310mAh","гейминг"
99,Steam Deck,gaming_handheld,49999,Портативная игровая система,"Экран: 7"" 60Hz, Процессор: AMD APU, Память: 16GB LPDDR5",Valve,4.6,16,"669g","Черный",1,2023,0,true,"256GB SSD","16GB","7"","40Wh","гейминг"
100,ASUS ROG Ally,gaming_handheld,59999,Игровая консоль на Windows,"Экран: 7"" 120Hz, Процессор: AMD Z1 Extreme, ОС: Windows 11",ASUS,4.5,12,"608g","Белый",2,2023,8,true,"512GB SSD","16GB","7"","40Wh","гейминг"